{
  "schema_version": "1.1",
  "dataset_id": "photography-skill-contract-fixture",
  "dataset_version": "1.0.0",
  "description": "用于验证训练数据清单契约的最小三分区示例，不是正式 60 图数据集。",
  "created_at": "2026-07-24T08:00:00Z",
  "content_hash": "sha256:bbbbbbbbbbbbbbbbbbbbbbbbbbbbbbbbbbbbbbbbbbbbbbbbbbbbbbbbbbbbbbbb",
  "split_counts": {
    "training": 1,
    "regression": 1,
    "holdout": 1,
    "total": 3
  },
  "assets": [
    {
      "asset_id": "landscape_training_001",
      "source_url": "https://example.com/photos/landscape-training-001",
      "download_url": "https://example.com/photos/landscape-training-001.jpg",
      "author": "契约示例作者",
      "license": "CC0 1.0",
      "license_url": "https://creativecommons.org/publicdomain/zero/1.0/",
      "source_kind": "open_license",
      "allowed_usage": "training_and_evaluation",
      "attribution": "契约示例，不对应实际训练图片",
      "source_file_sha1": "aaaaaaaaaaaaaaaaaaaaaaaaaaaaaaaaaaaaaaaa",
      "content_hash": "sha256:1111111111111111111111111111111111111111111111111111111111111111",
      "downloaded_at": "2026-07-24T08:00:00Z",
      "rights_verified_at": "2026-07-24T08:00:00Z",
      "portrait_or_personal_data": "none",
      "privacy_review": "not_applicable",
      "derivative_path": ".assets/landscape_training_001.jpg",
      "dataset_split": "training",
      "category": "landscape_nature",
      "status": "approved"
    },
    {
      "asset_id": "urban_regression_001",
      "source_url": "https://example.com/photos/urban-regression-001",
      "download_url": "https://example.com/photos/urban-regression-001.jpg",
      "author": "契约示例作者",
      "license": "CC0 1.0",
      "license_url": "https://creativecommons.org/publicdomain/zero/1.0/",
      "source_kind": "open_license",
      "allowed_usage": "training_and_evaluation",
      "attribution": "契约示例，不对应实际训练图片",
      "source_file_sha1": "bbbbbbbbbbbbbbbbbbbbbbbbbbbbbbbbbbbbbbbb",
      "content_hash": "sha256:2222222222222222222222222222222222222222222222222222222222222222",
      "downloaded_at": "2026-07-24T08:00:00Z",
      "rights_verified_at": "2026-07-24T08:00:00Z",
      "portrait_or_personal_data": "none",
      "privacy_review": "not_applicable",
      "derivative_path": ".assets/urban_regression_001.jpg",
      "dataset_split": "regression",
      "category": "urban_everyday",
      "status": "approved"
    },
    {
      "asset_id": "difficult_holdout_001",
      "source_url": "https://example.com/photos/difficult-holdout-001",
      "download_url": "https://example.com/photos/difficult-holdout-001.jpg",
      "author": "契约示例作者",
      "license": "CC0 1.0",
      "license_url": "https://creativecommons.org/publicdomain/zero/1.0/",
      "source_kind": "open_license",
      "allowed_usage": "evaluation",
      "attribution": "契约示例，不对应实际训练图片",
      "source_file_sha1": "cccccccccccccccccccccccccccccccccccccccc",
      "content_hash": "sha256:3333333333333333333333333333333333333333333333333333333333333333",
      "downloaded_at": "2026-07-24T08:00:00Z",
      "rights_verified_at": "2026-07-24T08:00:00Z",
      "portrait_or_personal_data": "none",
      "privacy_review": "not_applicable",
      "derivative_path": ".assets/difficult_holdout_001.jpg",
      "dataset_split": "holdout",
      "category": "ordinary_difficult",
      "status": "approved"
    }
  ]
}
